{
  "schemaVersion": 1,
  "routePlanId": "fixture:radial",
  "releaseId": "graph-v4-fixture-v1",
  "urlBuilderVersion": "google-maps-split/v1",
  "legs": [
    {
      "role": "surface_access",
      "urlSha256": "313da8968f106abcc8621e983f97bde4954ad6939fe2f92882bd4165bb3e1d36",
      "expectedRoad": "首都高速道路",
      "expectedDirection": "目黒入口から2号線外回りへ"
    },
    {
      "role": "loop_transfer",
      "urlSha256": "fc5f8d5f4b79166ae1baa6d9acf59e97af700bed455d06cb5e19134d57d9f995",
      "expectedRoad": "首都高速2号線",
      "expectedDirection": "2号線外回りで天現寺JCTまで"
    },
    {
      "role": "surface_return",
      "urlSha256": "732547520bdb5095faa437dc8c6c294362577cbc7b8922cfcd184da43f651844",
      "expectedRoad": "首都高速道路",
      "expectedDirection": "天現寺出口から出発地点へ"
    }
  ],
  "verifications": [
    {
      "os": "android",
      "osVersion": "unverified",
      "client": "web",
      "clientName": "chrome",
      "clientVersion": "unverified",
      "verifiedAt": null,
      "result": "missing",
      "expiresAt": null
    },
    {
      "os": "android",
      "osVersion": "unverified",
      "client": "app",
      "clientName": "google_maps",
      "clientVersion": "unverified",
      "verifiedAt": null,
      "result": "missing",
      "expiresAt": null
    },
    {
      "os": "ios",
      "osVersion": "unverified",
      "client": "web",
      "clientName": "safari",
      "clientVersion": "unverified",
      "verifiedAt": null,
      "result": "missing",
      "expiresAt": null
    },
    {
      "os": "ios",
      "osVersion": "unverified",
      "client": "app",
      "clientName": "google_maps",
      "clientVersion": "unverified",
      "verifiedAt": null,
      "result": "missing",
      "expiresAt": null
    }
  ]
}
